{
  "$schema": "../schemas/vector.schema.json",
  "version": "2.0.0",
  "description": "signature.recover: P256, WebAuthn and access-key (keychain V1/V2) envelopes, and WebAuthn clientDataJSON edge cases, with tempo-primitives verdicts.",
  "spec_ref": "Tempo signature envelopes: https://docs.tempo.xyz/protocol/transactions/spec-tempo-transaction#signature-types; tempo-primitives crates/primitives/src/transaction/tt_signature.rs TempoSignature::recover_signer",
  "generatedBy": "adapters/typescript/generate.ts (ox 0.14.59)",
  "commands": {
    "operation": "signature.recover"
  },
  "scenarios": [
    {
      "name": "sig_p256",
      "description": "P256 root signature (Account.fromP256, RFC 6979, low-s).",
      "tags": [
        "p256"
      ],
      "source": "tempo-go/pytempo testdata/viem/vectors.json (viem 2.57.13, ox 0.14.59)",
      "input": {
        "hash": "0xa23e3c649f0e2db95a197b12ab60133d57ad905619874c132f9d45cfbbb80326",
        "signature": "0x0136eb8138f5b6fa113d51b71aced4e702c3ea838aa3a06e626f9fea374a904504798935f3505063e5a3eff76af6b442bb49e66a9819a2963ac1bd75dee6365ede0217e617f0b6443928278f96999e69a23a4f2c152bdf6d6cdf66e5b80282d4ed194a7debcb97712d2dda3ca85aa8765a56f45fc758599652f2897c65306e579400"
      },
      "expected": {
        "ok": true,
        "value": {
          "signer": "0x9f2e642877a9411849763c250e5bb36cc57fedea"
        }
      }
    },
    {
      "name": "sig_webauthn",
      "description": "Headless WebAuthn signature, rpId localhost.",
      "tags": [
        "webauthn"
      ],
      "source": "tempo-go/pytempo testdata/viem/vectors.json (viem 2.57.13, ox 0.14.59)",
      "input": {
        "hash": "0xa23e3c649f0e2db95a197b12ab60133d57ad905619874c132f9d45cfbbb80326",
        "signature": "0x0249960de5880e8c687434170f6476605b8fe4aeb9a28632c7995cf3ba831d976305000000007b2274797065223a22776562617574686e2e676574222c226368616c6c656e6765223a226f6a34385a4a384f4c626c614758735371324154505665746b46595a683077544c3531467a377534417959222c226f726967696e223a22687474703a2f2f6c6f63616c686f7374222c2263726f73734f726967696e223a66616c73657d3d330c200606ba1b540d9d16802ab89e7f4df06d0e8908b24a837b5c0e8b4c4c78217ec5634a59167736eeb7e63931f5157774695610594c29474b425f45c255d65a93977caa3d1b081852ff57a79e465f1660577304baead505dd3a48589cf350185e895372df6221ea3a137557e473fddb6755f05bd507c3c533fce9c91285"
      },
      "expected": {
        "ok": true,
        "value": {
          "signer": "0x61c835c32c4bd8f60da77d577e4dfdc2dd5b6f9b"
        }
      }
    },
    {
      "name": "sig_p256_access_key_v2",
      "description": "P256 access key, keychain V2 envelope: signs for the root.",
      "tags": [
        "p256",
        "keychain",
        "keychain-v2"
      ],
      "source": "tempo-go/pytempo testdata/viem/vectors.json (viem 2.57.13, ox 0.14.59)",
      "input": {
        "hash": "0xa23e3c649f0e2db95a197b12ab60133d57ad905619874c132f9d45cfbbb80326",
        "signature": "0x04f39Fd6e51aad88F6F4ce6aB8827279cffFb922660142709d49fd7ba5b5ffcda06b40f60342592c931ba3e5446e02c50e18f9f0a7fc1dc89946595834b402a855467df4b337f3b20dd52ef033150056baf2de9464ff0217e617f0b6443928278f96999e69a23a4f2c152bdf6d6cdf66e5b80282d4ed194a7debcb97712d2dda3ca85aa8765a56f45fc758599652f2897c65306e579400"
      },
      "expected": {
        "ok": true,
        "value": {
          "signer": "0xf39fd6e51aad88f6f4ce6ab8827279cfffb92266"
        }
      }
    },
    {
      "name": "sig_webauthn_access_key_v2",
      "description": "WebAuthn access key, keychain V2 envelope.",
      "tags": [
        "webauthn",
        "keychain",
        "keychain-v2"
      ],
      "source": "tempo-go/pytempo testdata/viem/vectors.json (viem 2.57.13, ox 0.14.59)",
      "input": {
        "hash": "0xa23e3c649f0e2db95a197b12ab60133d57ad905619874c132f9d45cfbbb80326",
        "signature": "0x04f39Fd6e51aad88F6F4ce6aB8827279cffFb922660249960de5880e8c687434170f6476605b8fe4aeb9a28632c7995cf3ba831d976305000000007b2274797065223a22776562617574686e2e676574222c226368616c6c656e6765223a2247673363647961687a496c6b4a68513847455575743739314757384e597578366835567a34444f39676a6f222c226f726967696e223a22687474703a2f2f6c6f63616c686f7374222c2263726f73734f726967696e223a66616c73657dd8c48595140306993fcfd4fc54bf4872fa5ecd2c95ae5034fcd6c542b2bb6b1661722ec44bfa3e63037ac3bd85673eac886fd19eba33a25037fdae15f31449d7d65a93977caa3d1b081852ff57a79e465f1660577304baead505dd3a48589cf350185e895372df6221ea3a137557e473fddb6755f05bd507c3c533fce9c91285"
      },
      "expected": {
        "ok": true,
        "value": {
          "signer": "0xf39fd6e51aad88f6f4ce6ab8827279cfffb92266"
        }
      }
    },
    {
      "name": "sig_p256_keychain_v1",
      "description": "Legacy keychain V1 envelope wrapping a P256 signature.",
      "tags": [
        "p256",
        "keychain",
        "keychain-v1"
      ],
      "source": "tempo-go/pytempo testdata/viem/vectors.json (viem 2.57.13, ox 0.14.59)",
      "input": {
        "hash": "0xa23e3c649f0e2db95a197b12ab60133d57ad905619874c132f9d45cfbbb80326",
        "signature": "0x03f39Fd6e51aad88F6F4ce6aB8827279cffFb922660136eb8138f5b6fa113d51b71aced4e702c3ea838aa3a06e626f9fea374a904504798935f3505063e5a3eff76af6b442bb49e66a9819a2963ac1bd75dee6365ede0217e617f0b6443928278f96999e69a23a4f2c152bdf6d6cdf66e5b80282d4ed194a7debcb97712d2dda3ca85aa8765a56f45fc758599652f2897c65306e579400"
      },
      "expected": {
        "ok": true,
        "value": {
          "signer": "0xf39fd6e51aad88f6f4ce6ab8827279cfffb92266"
        }
      }
    },
    {
      "name": "webauthn_client_data_canonical",
      "description": "WebAuthn signature over an unusual clientDataJSON encoding: canonical.",
      "tags": [
        "webauthn",
        "client-data-json"
      ],
      "source": "tempo-go/pytempo testdata/viem/webauthn_client_data.json; verdict from tempo-primitives 1.11.0 recover_signer",
      "input": {
        "hash": "0xa23e3c649f0e2db95a197b12ab60133d57ad905619874c132f9d45cfbbb80326",
        "signature": "0x0249960de5880e8c687434170f6476605b8fe4aeb9a28632c7995cf3ba831d976305000000007b2274797065223a22776562617574686e2e676574222c226368616c6c656e6765223a226f6a34385a4a384f4c626c614758735371324154505665746b46595a683077544c3531467a377534417959227d433bce095153046913dab8ec2db8fe0650f3ed9c1b339b3671df5a7c3b7e445f6c1265f1f8513e97270775bc1bf7c2c1f7b2bd8926b16d1b44ff08b4ffb5a848d65a93977caa3d1b081852ff57a79e465f1660577304baead505dd3a48589cf350185e895372df6221ea3a137557e473fddb6755f05bd507c3c533fce9c91285"
      },
      "expected": {
        "ok": true,
        "value": {
          "signer": "0x61c835c32c4bd8f60da77d577e4dfdc2dd5b6f9b"
        }
      }
    },
    {
      "name": "webauthn_client_data_reordered_with_unknown_fields",
      "description": "WebAuthn signature over an unusual clientDataJSON encoding: reordered with unknown fields.",
      "tags": [
        "webauthn",
        "client-data-json"
      ],
      "source": "tempo-go/pytempo testdata/viem/webauthn_client_data.json; verdict from tempo-primitives 1.11.0 recover_signer",
      "input": {
        "hash": "0xa23e3c649f0e2db95a197b12ab60133d57ad905619874c132f9d45cfbbb80326",
        "signature": "0x0249960de5880e8c687434170f6476605b8fe4aeb9a28632c7995cf3ba831d976305000000007b226f726967696e223a2278222c226368616c6c656e6765223a226f6a34385a4a384f4c626c614758735371324154505665746b46595a683077544c3531467a377534417959222c226e223a5b312c7b2261223a327d5d2c2274797065223a22776562617574686e2e676574227d47dacf4c8714bab3ef0aa2880572009cc139f13ee6e9a0c1ceaa0f49f570eb6553369d695dc5abbc79c43de2bff3fa0f088be96f89d391970de9b88f8f9e7e1ad65a93977caa3d1b081852ff57a79e465f1660577304baead505dd3a48589cf350185e895372df6221ea3a137557e473fddb6755f05bd507c3c533fce9c91285"
      },
      "expected": {
        "ok": true,
        "value": {
          "signer": "0x61c835c32c4bd8f60da77d577e4dfdc2dd5b6f9b"
        }
      }
    },
    {
      "name": "webauthn_client_data_whitespace",
      "description": "WebAuthn signature over an unusual clientDataJSON encoding: whitespace.",
      "tags": [
        "webauthn",
        "client-data-json"
      ],
      "sdkVersions": {
        "typescript": ">0.14.59"
      },
      "skipReasons": {
        "typescript": "ox rejects this clientDataJSON, but tempo-primitives (the node) accepts it: ox requires the canonical serialization the node does not. Not fixed in ox yet: re-check on the next ox bump."
      },
      "source": "tempo-go/pytempo testdata/viem/webauthn_client_data.json; verdict from tempo-primitives 1.11.0 recover_signer",
      "input": {
        "hash": "0xa23e3c649f0e2db95a197b12ab60133d57ad905619874c132f9d45cfbbb80326",
        "signature": "0x0249960de5880e8c687434170f6476605b8fe4aeb9a28632c7995cf3ba831d976305000000007b20227479706522203a2022776562617574686e2e67657422202c0a20226368616c6c656e676522203a20226f6a34385a4a384f4c626c614758735371324154505665746b46595a683077544c3531467a37753441795922207d0a1c477a578a11d013a5da82073de1b225391e652e31212b4e14bf26bc3845cd9a41fdc8f7e4b9b167c05982c0c293f576f2dfb427ccfa1e7f31e1f917b978ead3d65a93977caa3d1b081852ff57a79e465f1660577304baead505dd3a48589cf350185e895372df6221ea3a137557e473fddb6755f05bd507c3c533fce9c91285"
      },
      "expected": {
        "ok": true,
        "value": {
          "signer": "0x61c835c32c4bd8f60da77d577e4dfdc2dd5b6f9b"
        }
      }
    },
    {
      "name": "webauthn_client_data_escaped_unknown_field",
      "description": "WebAuthn signature over an unusual clientDataJSON encoding: escaped unknown field.",
      "tags": [
        "webauthn",
        "client-data-json"
      ],
      "source": "tempo-go/pytempo testdata/viem/webauthn_client_data.json; verdict from tempo-primitives 1.11.0 recover_signer",
      "input": {
        "hash": "0xa23e3c649f0e2db95a197b12ab60133d57ad905619874c132f9d45cfbbb80326",